{
  "$schema": "https://json-schema.org/draft/2020-12/schema",
  "$id": "https://synapt.dev/schemas/extract/v1.json",
  "title": "SynaptExtraction",
  "description": "SynaptExtraction IL v1 — universal exchange format between text extraction and intelligence operations.",
  "type": "object",
  "properties": {
    "version": {
      "const": "1",
      "description": "Schema major version."
    },
    "extracted_at": {
      "type": "string",
      "format": "date-time",
      "pattern": "^\\d{4}-\\d{2}-\\d{2}T\\d{2}:\\d{2}(?::\\d{2})?(?:\\.\\d+)?(?:Z|[+\\-]\\d{2}:?\\d{2})?$",
      "description": "When the extraction was performed (ISO 8601)."
    },
    "source_id": {
      "type": "string",
      "description": "Customer's external document ID (e.g., prayer_id, session_id). Idempotency key for memory.ingest()."
    },
    "source_type": {
      "type": "string",
      "description": "Type of source document."
    },
    "user_id": {
      "type": "string",
      "description": "Customer's user identifier."
    },
    "produced_by": {
      "oneOf": [
        {
          "type": "string",
          "pattern": "^[a-zA-Z][a-zA-Z0-9+.\\-]*://\\S+$"
        },
        {
          "$ref": "https://synapt.dev/schemas/producer/v1.json"
        }
      ],
      "description": "Model that produced the extraction. String form (v1.0): provider URI. Object form (v1.1): structured SynaptProducer. v1.1 is additive for schema validators and type-tolerant readers; v1.0 consumer code that performs string operations on produced_by without a type guard will break on v1.1 object-form documents. Readers MUST branch on string vs object."
    },
    "kind": {
      "type": "string",
      "pattern": "^[a-zA-Z0-9_\\-]+/[a-zA-Z0-9_\\-]+$",
      "description": "Primary extension. Identifies the dominant domain context. Format: \"vendor/kind\"."
    },
    "entities": {
      "type": "array",
      "items": { "$ref": "https://synapt.dev/schemas/entity/v1.json" },
      "description": "Extracted entities."
    },
    "goals": {
      "type": "array",
      "items": { "$ref": "https://synapt.dev/schemas/goal/v1.json" },
      "description": "Extracted goals."
    },
    "themes": {
      "type": "array",
      "items": { "type": "string", "minLength": 1 },
      "description": "Topic strings."
    },
    "keywords": {
      "type": "array",
      "items": { "type": "string", "minLength": 1 },
      "description": "Surface lexical terms extracted from the source. Sibling to themes; keywords are specific terms while themes are topical categories."
    },
    "sentiment": {
      "oneOf": [
        {
          "type": "string"
        },
        {
          "$ref": "https://synapt.dev/schemas/sentiment/v1.json"
        }
      ],
      "description": "Overall emotional tone. String form (v1.0): free-text sentiment. Object form (v1.2): structured SynaptSentiment with valence, intensity, confidence. Readers MUST branch on string vs object."
    },
    "summary": {
      "type": "string",
      "minLength": 1,
      "description": "One-sentence summary, max 200 characters."
    },
    "facts": {
      "type": "array",
      "items": { "$ref": "#/$defs/SynaptFact" },
      "description": "Extracted factual statements."
    },
    "questions": {
      "type": "array",
      "items": { "$ref": "https://synapt.dev/schemas/question/v1.json" },
      "description": "Questions raised in the source text."
    },
    "actions": {
      "type": "array",
      "items": { "$ref": "https://synapt.dev/schemas/action/v1.json" },
      "description": "Concrete next-steps or action items. Origin field distinguishes extracted actions from those inferred from goals."
    },
    "decisions": {
      "type": "array",
      "items": { "$ref": "https://synapt.dev/schemas/decision/v1.json" },
      "description": "Directional commitments identified in the source text."
    },
    "temporal_refs": {
      "type": "array",
      "items": { "$ref": "https://synapt.dev/schemas/temporal-ref/v1.json" },
      "description": "Temporal references extracted from the source."
    },
    "language": {
      "type": "string",
      "pattern": "^[a-zA-Z]{2,3}(?:-[a-zA-Z0-9]{1,8})*$",
      "description": "IETF BCP 47 language tag of the source text (e.g., \"en-US\", \"es\", \"pt-BR\")."
    },
    "source_metadata": {
      "$ref": "https://synapt.dev/schemas/source-metadata/v1.json",
      "description": "Metadata about the source document (token count, character count, modality, format)."
    },
    "confidence": {
      "type": "number",
      "minimum": 0,
      "maximum": 1,
      "description": "Extraction-level overall confidence score (0.0 to 1.0)."
    },
    "capabilities": {
      "type": "array",
      "items": {
        "type": "string",
        "enum": [
          "entities", "entity_state", "entity_context", "entity_ids",
          "goals", "goal_timing", "goal_entity_refs",
          "themes", "keywords", "summary", "sentiment", "structured_sentiment",
          "facts", "questions", "actions", "decisions",
          "temporal_refs", "temporal_classes",
          "relations", "relation_origin",
          "assertion_signals", "evidence_anchoring",
          "language", "source_metadata", "confidence"
        ]
      },
      "description": "Which extraction capabilities the producer attempted to fill."
    },
    "embeddings": {
      "type": "array",
      "items": { "$ref": "https://synapt.dev/schemas/embedding/v1.json" },
      "description": "Pre-computed embeddings."
    },
    "extensions": {
      "type": "object",
      "propertyNames": {
        "pattern": "^[a-zA-Z0-9_\\-]+/[a-zA-Z0-9_\\-]+$"
      },
      "additionalProperties": true,
      "description": "Domain-specific structured extras. Keys are scoped: \"vendor/kind\"."
    }
  },
  "required": ["version", "extracted_at", "produced_by", "entities", "goals", "themes", "capabilities"],
  "additionalProperties": false,
  "$defs": {
    "SynaptSourceRef": {
      "$ref": "https://synapt.dev/schemas/source-ref/v1.json"
    },
    "SynaptAssertionSignals": {
      "$ref": "https://synapt.dev/schemas/assertion-signals/v1.json"
    },
    "SynaptFact": {
      "type": "object",
      "description": "Extracted factual statement.",
      "properties": {
        "text": {
          "type": "string",
          "minLength": 1,
          "description": "The factual statement."
        },
        "category": {
          "type": "string",
          "description": "Fact category."
        },
        "source": { "$ref": "https://synapt.dev/schemas/source-ref/v1.json" },
        "signals": { "$ref": "https://synapt.dev/schemas/assertion-signals/v1.json" }
      },
      "required": ["text"],
      "additionalProperties": false
    }
  }
}
