{
  "version": "1",
  "extracted_at": "2026-04-20T10:00:00Z",
  "source_id": "alpha",
  "produced_by": "anthropic://claude-sonnet-4-6",
  "entities": [
    {
      "id": "e1",
      "name": "Mom",
      "type": "person",
      "state": "recovering",
      "date_hint": "2026-04-20",
      "relations": [
        {
          "target": "e2",
          "type": "parent_of"
        }
      ]
    },
    {
      "id": "e2",
      "name": "Me",
      "type": "person"
    }
  ],
  "goals": [
    {
      "text": "Mom's recovery",
      "status": "open",
      "entity_refs": ["e1"]
    }
  ],
  "themes": ["Health", "Family"],
  "summary": "Mom is recovering after surgery.",
  "facts": [
    {
      "text": "Mom had surgery."
    }
  ],
  "capabilities": ["entities", "entity_state", "entity_ids", "goals", "goal_entity_refs", "themes", "summary", "facts", "relations"]
}
