{
  "version": "1",
  "extracted_at": "2026-04-27T09:00:00Z",
  "source_id": "charlie",
  "produced_by": "anthropic://claude-sonnet-4-6",
  "entities": [
    {
      "id": "e4",
      "name": "Church",
      "type": "organization"
    }
  ],
  "goals": [
    {
      "text": "Organize meal train",
      "status": "open",
      "entity_refs": ["e4"]
    }
  ],
  "themes": ["Community", "Support", "Health"],
  "summary": "Church volunteers want to help with meals.",
  "capabilities": ["entities", "entity_ids", "goals", "goal_entity_refs", "themes", "summary"]
}
